{
  "formatVersion": 1,
  "language": "en",
  "profile": {
    "name": "Alex Morgan",
    "dateOfBirth": "1988-04-12",
    "placeOfBirth": "Brookfield, Germany",
    "placesLived": "Seabrook, 1991–1994. Then Oakridge."
  },
  "entries": [
    {
      "type": "text",
      "topic": "Childhood treasures",
      "question": "What small childhood memory still makes you smile?",
      "text": "The beaches in Seabrook and sledding on the hill in Oakridge.",
      "createdAt": "2026-10-22T18:30:00Z",
      "modificationDates": ["2026-10-22T18:40:00Z"]
    },
    {
      "type": "photo",
      "description": "Example only: a childhood photograph on a beach in Seabrook, around 1993.",
      "caption": "Seabrook, around 1993",
      "filePath": "media/seabrook-beach.jpg",
      "createdAt": "2026-10-22T18:35:00Z",
      "modificationDates": []
    },
    {
      "type": "text",
      "question": null,
      "text": "Example journal entry: today I wanted to write down a few small memories before I forget them.",
      "createdAt": "2026-10-22T19:00:00Z",
      "modificationDates": []
    }
  ]
}
